{
  "$schema": "https://json-schema.org/draft/2020-12/schema",
  "$id": "https://pllm.run/schemas/experiment.schema.json",
  "title": "PLLM experiment v2",
  "type": "object",
  "additionalProperties": false,
  "required": ["schema", "name", "pipeline", "deployment", "budget"],
  "properties": {
    "schema": {"const": "pllm.experiment.v2"},
    "name": {"type": "string", "minLength": 1},
    "pipeline": {
      "type": "object",
      "additionalProperties": false,
      "required": ["model", "components"],
      "properties": {
        "model": {
          "type": "object",
          "additionalProperties": false,
          "required": ["source"],
          "properties": {
            "source": {"type": "string", "minLength": 1},
            "kind": {"enum": ["huggingface", "safetensors", "vllm", "mlx", "mlx-lm", "gguf", "llama.cpp", "ollama", "tiny"]},
            "model_id": {"type": "string", "minLength": 1},
            "revision": {"type": "string", "minLength": 1},
            "local_files_only": {"type": "boolean"},
            "endpoint": {"type": "string", "minLength": 1}
          },
          "allOf": [
            {
              "if": {"required": ["revision"]},
              "then": {"properties": {"kind": {"enum": ["huggingface", "safetensors", "vllm"]}}}
            },
            {
              "if": {"properties": {"local_files_only": {"const": true}}, "required": ["local_files_only"]},
              "then": {"properties": {"kind": {"enum": ["huggingface", "safetensors", "vllm"]}}}
            },
            {
              "if": {"required": ["endpoint"]},
              "then": {"properties": {"kind": {"const": "ollama"}}, "required": ["kind"]}
            }
          ]
        },
        "components": {
          "type": "object",
          "propertyNames": {"pattern": "^(?!.*__).+$"},
          "additionalProperties": {"$ref": "#/$defs/componentRef"}
        }
      }
    },
    "deployment": {
      "type": "object",
      "additionalProperties": false,
      "required": ["kind", "root"],
      "properties": {
        "kind": {"const": "local"},
        "root": {"type": "string", "minLength": 1}
      }
    },
    "budget": {
      "type": "object",
      "additionalProperties": false,
      "required": ["requests", "max_input_tokens", "max_new_tokens"],
      "properties": {
        "requests": {"type": "integer", "minimum": 1},
        "max_input_tokens": {"type": "integer", "minimum": 1},
        "max_new_tokens": {"type": "integer", "minimum": 1}
      }
    }
  },
  "$defs": {
    "jsonValue": {
      "anyOf": [
        {"type": ["null", "boolean", "string", "number"]},
        {"type": "array", "items": {"$ref": "#/$defs/jsonValue"}},
        {
          "type": "object",
          "propertyNames": {"pattern": "^(?!.*__).+$"},
          "additionalProperties": {"$ref": "#/$defs/jsonValue"}
        }
      ]
    },
    "componentRef": {
      "type": "object",
      "additionalProperties": false,
      "required": ["component", "params"],
      "properties": {
        "component": {"type": "string", "minLength": 1},
        "params": {
          "type": "object",
          "propertyNames": {"pattern": "^(?!component$)(?!params$)(?!.*__).+$"},
          "additionalProperties": {"$ref": "#/$defs/jsonValue"}
        }
      },
      "allOf": [
        {
          "if": {"properties": {"component": {"const": "pllm/cpu"}}, "required": ["component"]},
          "then": {
            "properties": {
              "params": {
                "type": "object",
                "additionalProperties": false,
                "required": ["threads"],
                "properties": {"threads": {"type": "integer", "minimum": 1}}
              }
            }
          }
        },
        {
          "if": {
            "properties": {"component": {"const": "pllm/one-online-provider-offline-preparation/v1"}},
            "required": ["component"]
          },
          "then": {"properties": {"params": {"maxProperties": 0}}}
        },
        {
          "if": {
            "properties": {
              "component": {
                "enum": ["pllm/masked-linear", "pllm/model-aware-corrections", "pllm/inference"]
              }
            },
            "required": ["component"]
          },
          "then": {"properties": {"params": {"maxProperties": 0}}}
        },
        {
          "if": {
            "properties": {"component": {"const": "pllm/freivalds-verify/v1"}},
            "required": ["component"]
          },
          "then": {
            "properties": {
              "params": {
                "type": "object",
                "additionalProperties": false,
                "required": ["target_failure_bits"],
                "properties": {
                  "target_failure_bits": {"type": "integer", "minimum": 1, "maximum": 80}
                }
              }
            }
          }
        }
      ]
    }
  }
}
